{
  "overlay_id": "RSO-DE-EMANUEL-1989-0001",
  "scope": {
    "primary_carrier_id": "DE-EMANUEL-1989",
    "time_window": {
      "start_year": 1989,
      "end_year": null
    }
  },
  "strands": [
    "RS-IRS-EMANUEL-ARCHASTRO-0001"
  ],
  "edges": [],
  "metadata": {
    "created": "2026-01-25",
    "updated": "2026-01-25",
    "version": "1.0.0",
    "status": "active",
    "notes": "Erstes Resonance Strands Overlay für DE-EMANUEL-1989. Enthält einen IRS Strand zur Archäoastronomie und Memory Resonance."
  }
}